<?xml version="1.0" encoding="UTF-8"?>
<Employees xmlns:xsi="http://www.w3.org/2001/XMLSchema-instance"
    xsi:noNamespaceSchemaLocation="Q4.XSD">
    <Employee>
        <EmployeeId>A-84</EmployeeId>
        <Name>Pujan Saraniya</Name>
        <Children>
            <Boy>
                <Name>XYZ Saraniya</Name>
                <Birthdate>2030-09-15</Birthdate>
            </Boy>
            <Girl>
                <Name>XYZ Saraniya</Name>
                <Birthdate>2030-05-12</Birthdate>
            </Girl>
        </Children>
    </Employee>
    <Employee>
        <EmployeeId></EmployeeId>
        <Name>Pujan Saraniya</Name>
        <Children>
            <Boy>
                <Name>XYZ Saraniya</Name>
                <Birthdate>2030-11-20</Birthdate>
            </Boy>
            <Girl>
                <Name>XYZ Saraniya</Name>
                <Birthdate>2030-05-12</Birthdate>
            </Girl>
        </Children>
    </Employee>
</Employees>